{
  "$schema": "https://json-schema.org/draft/2020-12/schema",
  "$id": "https://intercore.dev/contracts/cli/dispatch.json",
  "properties": {
    "id": {
      "type": "string"
    },
    "agent_type": {
      "type": "string"
    },
    "status": {
      "type": "string"
    },
    "project_dir": {
      "type": "string"
    },
    "prompt_file": {
      "type": "string"
    },
    "output_file": {
      "type": "string"
    },
    "pid": {
      "type": "integer"
    },
    "exit_code": {
      "type": "integer"
    },
    "name": {
      "type": "string"
    },
    "model": {
      "type": "string"
    },
    "turns": {
      "type": "integer"
    },
    "commands": {
      "type": "integer"
    },
    "messages": {
      "type": "integer"
    },
    "in_tokens": {
      "type": "integer"
    },
    "out_tokens": {
      "type": "integer"
    },
    "cache_hits": {
      "type": "integer"
    },
    "created_at": {
      "type": "integer"
    },
    "started_at": {
      "type": "integer"
    },
    "completed_at": {
      "type": "integer"
    },
    "verdict_status": {
      "type": "string"
    },
    "verdict_summary": {
      "type": "string"
    },
    "error_message": {
      "type": "string"
    },
    "failure_class": {
      "type": "string"
    },
    "sandbox_spec": true,
    "sandbox_effective": true,
    "scope_id": {
      "type": "string"
    },
    "parent_id": {
      "type": "string"
    }
  },
  "additionalProperties": false,
  "type": "object",
  "required": [
    "id",
    "agent_type",
    "status",
    "project_dir",
    "turns",
    "commands",
    "messages",
    "in_tokens",
    "out_tokens",
    "created_at"
  ]
}
