{
  "id": "fixture1",
  "agent_type": "flere",
  "status": "completed",
  "project_dir": "/fixture/project",
  "prompt_file": "/fixture/prompt.md",
  "output_file": "/fixture/output.md",
  "pid": 123,
  "exit_code": 0,
  "name": "",
  "model": "fixture-model",
  "turns": 2,
  "commands": 3,
  "messages": 4,
  "in_tokens": 5,
  "out_tokens": 6,
  "cache_hits": 0,
  "created_at": 1700000000,
  "started_at": 1700000001,
  "completed_at": 1700000002,
  "verdict_status": "pass",
  "verdict_summary": "fixture completed",
  "error_message": "",
  "failure_class": "",
  "sandbox_spec": {"mode": "read-only", "network": false},
  "sandbox_effective": {"mode": "read-only", "paths": ["/fixture/project"]},
  "scope_id": "fixture-run",
  "parent_id": "fixture-parent"
}
